<?xml version="1.0" encoding="UTF-8" standalone="no"?>
<!DOCTYPE GlobalConfiguration SYSTEM "GlobalConfiguration.dtd">
<GlobalConfiguration>
    <ApplicationName>Application</ApplicationName>
    <StartAddress>
        <Calibration>000FE000</Calibration>
        <RamShadow>14000000</RamShadow>
        <ROM>000FF000</ROM>
        <EepromAlias>EE010000</EepromAlias>
        <EepromAliasId>3</EepromAliasId>
    </StartAddress>
    <Version name="Calib">
        <Major>1</Major>
        <Minor>1</Minor>
        <Subversion>1</Subversion>
    </Version>
    <Version name="E2P">
        <Major>1</Major>
        <Minor>1</Minor>
        <Subversion>1</Subversion>
    </Version>
    <MemorySize>
        <CalibrationSize>4096</CalibrationSize>
        <RomSize>4096</RomSize>
    </MemorySize>
</GlobalConfiguration>
